lemma	word	translation
G3538	νίπτω	to cleanse (especially the hands or the feet or the face); ceremonially, to perform ablution
G5608	ὠνέομαι	to purchase (synonymous with the earlier G4092 (ὠνέομαι))
G2674	καταριθμέω	to reckon among
G5615	ὡσαύτως	as thus, i.e. in the same way
G3158	Ματθάτ	Matthat (i.e. Mattithjah), the name of two Israelites
G4376	προσφορά	presentation; concretely, an oblation (bloodless) or sacrifice
G3838	παντελής	full-ended, i.e. entire (neuter as noun, completion)
G2206	ζηλόω	to have warmth of feeling for or against
G3389	μητραλῴας	a mother-thresher, i.e. matricide
G2677	καταρτισμός	complete furnishing (objectively)
G4982	σώζω	to save, i.e. deliver or protect (literally or figuratively)
G3554	νόσος	a malady (rarely figuratively, of moral disability)
G25	ἀγαπάω	to love (in a social or moral sense)
G2387	Ἰαμβρῆς	Jambres, an Egyptian
G4020	περιεργάζομαι	to work all around, i.e. bustle about (meddle)
G3804	πάθημα	something undergone, i.e. hardship or pain; subjectively, an emotion or influence
G642	ἀπορφανίζω	to bereave wholly, i.e. (figuratively) separate (from intercourse)
G1296	διαταγή	arrangement, i.e. institution
G3855	παράγω	to lead near, i.e. (reflexively or intransitively) to go along or away
G343	ἀνακαλύπτω	to unveil
G4640	σκιρτάω	to jump, i.e. sympathetically move (as the quickening of a fetus)
G4708	σπουδαιοτέρως	more speedily, i.e. sooner than otherwise
G3315	μεσιτεύω	to interpose (as arbiter), i.e (by implication) to ratify (as surety)
G1892	ἐπεγείρω	to rouse upon, i.e. (figuratively) to excite against
G2974	κωφός	blunted, i.e. (figuratively) of hearing (deaf) or speech (dumb)
G2355	θρῆνος	wailing
G4638	σκήνωμα	an encampment, i.e. (figuratively) the Temple (as God's residence), the body (as a tenement for the soul)
G1730	ἔνδειγμα	an indication (concretely)
G2789	κιθαρίζω	to play on a lyre
G2899	κράσπεδον	a margin, i.e. (specially), a fringe or tassel
G3755	ὅτου	during which same time, i.e. whilst
G225	ἀλήθεια	truth
G4360	προσοχθίζω	to feel indignant at
G2972	Κώς	Cos, an island in the Mediterranean
G2510	καθάπτω	to seize upon
G4218	ποτέ	indefinite adverb, at some time, ever
G2414	Ἱεροσόλυμα	Hierosolyma (i.e. Jerushalaim), the capitol of Palestine
G5033	τάχιστα	most quickly, i.e. (with G5613 (τάχιστα) prefixed) as soon as possible
G2472	ἰσότιμος	of equal value or honor
G3726	ὁρκίζω	to put on oath, i.e. make swear; by analogy, to solemnly enjoin
G5191	ὑακίνθινος	"hyacinthine" or "jacinthine", i.e. deep blue
G846	αὐτός	the reflexive pronoun self, used (alone or in the comparative G1438 (αὐτός)) of the third person , and (with the proper personal pronoun) of the other persons
G4827	συμμαθητής	a co-learner (of Christianity)
G2169	εὐχαριστία	gratitude; actively, grateful language (to God, as an act of worship)
G1720	ἐμφυσάω	to blow at or on
G4895	σύνειμι	to be in company with, i.e. present at the time
G5458	φωστήρ	an illuminator, i.e. (concretely) a luminary, or (abstractly) brilliancy
G3073	Λυκία	Lycia, a province of Asia Minor
G3183	μέθυσος	tipsy, i.e. (as noun) a sot
G3021	λευκαίνω	to whiten
G1320	διδάσκαλος	an instructor (genitive case or specially)
G2076	ἐστί	he (she or it) is; also (with neuter plural) they are
G4086	πιθανολογία	persuasive language
G212	ἀλαζονεία	braggadocio, i.e. (by implication) self-confidence
G442	ἀνθρώπινος	human
G4508	ῥυπαρός	dirty, i.e. (relatively) cheap or shabby; morally, wicked
G2948	κυλλός	rocking about, i.e. crippled (maimed, in feet or hands)
G1181	δεκάτη	a tenth, i.e. as a percentage or (technically) tithe
G4029	περίκειμαι	to lie all around, i.e. inclose, encircle, hamper (literally or figuratively)
G2608	κατάγνυμι	to rend in pieces, i.e. crack apart
G2771	κέρδος	gain (pecuniary or genitive case)
G607	ἀποκεφαλίζω	to decapitate
G2611	καταδέω	to tie down, i.e. bandage (a wound)
G5620	ὥστε	so too, i.e. thus therefore (in various relations of consecution, as follow)
G3676	ὅμως	at the same time, i.e. (conjunctionally) notwithstanding, yet still
G1947	ἐπικουρία	assistance
G4525	σαίνω	to wag (as a dog its tail fawningly), i.e. (generally) to shake (figuratively, disturb)
G2617	καταισχύνω	to shame down, i.e. disgrace or (by implication) put to the blush
G4751	στόμαχος	an orifice (the gullet), i.e. (specially), the "stomach"
G3074	λύκος	a wolf
G981	βίωσις	living (properly, the act, by implication, the mode)
G5056	τέλος	properly, the point aimed at as a limit, i.e. (by implication) the conclusion of an act or state (termination (literally, figuratively or indefinitely), result (immediate, ultimate or prophetic), purpose); specially, an impost or levy (as paid)
G4994	σωφρονίζω	to make of sound mind, i.e. (figuratively) to discipline or correct
G3666	ὁμοιόω	to assimilate, i.e. compare; passively, to become similar
G2120	εὐκαιρία	a favorable occasion
G832	αὐλέω	to play the flute
G584	ἀποδείκνυμι	to show off, i.e. exhibit; figuratively, to demonstrate, i.e. accredit
G2175	εὐωδία	good-scentedness, i.e. fragrance
G574	ἁπλῶς	bountifully; 
G1333	διετία	a space of two years (biennium)
G180	ἀκατάπαυστος	unrefraining
G1843	ἐξομολογέω	to acknowledge or (by implication, of assent) agree fully
G3427	μοί	to me
G2803	Κλαυδία	Claudia, a Christian woman
G4977	σχίζω	to split or sever (literally or figuratively)
G2326	θερισμός	reaping, i.e. the crop
G4496	ῥίπτω	to fling (properly, with a quick toss, thus differing from G906 (ῥίπτω), which denotes a deliberate hurl; and from (see in G1614 (ῥίπτω)), which indicates an extended projection); by qualification, to deposit (as if a load); by extension, to disperse
G3171	μεγάλως	much
G2667	καταπίπτω	to fall down
G2875	κόπτω	to "chop"; specially, to beat the breast in grief
G4961	συστρατιώτης	a co-campaigner, i.e. (figuratively) an associate in Christian toil
G3437	μομφή	blame, i.e. (by implication), a fault
G1649	ἔλεγξις	refutation, i.e. reproof
G2199	Ζεβεδαῖος	Zebedæus, an Israelite
G5469	χαλινός	a curb or head-stall (as curbing the spirit)
G3191	μελετάω	to take care of, i.e. (by implication) revolve in the mind
G872	ἀφοράω	to consider attentively
G970	βία	force
G1496	εἰδωλολάτρης	an image- (servant or) worshipper (literally or figuratively)
G5516	χξϛ	666 as a numeral
G3125	μάμμη	a grandmother
G5262	ὑπόδειγμα	an exhibit for imitation or warning (figuratively, specimen, adumbration)
G4105	πλανάω	to (properly, cause to) roam (from safety, truth, or virtue)
G273	ἄμεμπτος	irreproachable
G515	ἀξιόω	to deem entitled or fit
G4161	ποίημα	a product, i.e. fabric (literally or figuratively)
G994	βοάω	to halloo, i.e. shout (for help or in a tumultuous way)
G1103	γνήσιος	legitimate (of birth), i.e. genuine
G3560	νουθετέω	to put in mind, i.e. (by implication) to caution or reprove gently
G3066	Λούκιος	illuminative; Lucius, a Christian
G1332	διετής	of two years (in age)
G1288	διασπάω	to draw apart, i.e. sever or dismember
G4998	σώφρων	safe (sound) in mind, i.e. self-controlled (moderate as to opinion or passion)
G5312	ὑψόω	to elevate (literally or figuratively)
G2682	κατασκήνωσις	an encamping, i.e. (figuratively) a perch
G1481	ἐθνάρχης	the governor (not king) of a district
G2845	κοίτη	a couch; by extension, cohabitation; by implication, the male sperm
G1451	ἐγγύς	akin to the base of G43 (ἐγγύς)); near (literally or figuratively, of place or time)
G2892	κουστωδία	"custody", i.e. a Roman sentry
G1553	ἐκδημέω	to emigrate, i.e. (figuratively) vacate or quit
G3596	ὁδοιπορέω	to be a wayfarer, i.e. travel
G3485	ναός	a fane, shrine, temple 
G4842	συμπέμπω	to despatch in company
G4238	πράσσω	to "practise", i.e. perform repeatedly or habitually (thus differing from G4160 (πράσσω), which properly refers to a single act); by implication, to execute, accomplish, etc.; specially, to collect (dues), fare (personally)
G2223	ζώνη	a belt; by implication, a pocket
G272	ἀμελέω	to be careless of
G2087	ἕτερος	(an-, the) other or different
G4045	περιπίπτω	to fall into something that is all around, i.e. light among or upon, be surrounded with
G2111	εὔθετος	well placed, i.e. (figuratively) appropriate
G5324	φαντάζω	to make apparent, i.e. (passively) to appear (neuter participle as noun, a spectacle)
G957	βελτίον	better
G4127	πληγή	a stroke; by implication, a wound; figuratively, a calamity
G338	ἀναίτιος	innocent
G3328	μεταβάλλω	to throw over, i.e. (middle voice figuratively) to turn about in opinion
G3592	τόδε	the same, i.e. this or that one (plural these or those); often used as a personal pronoun
G4939	σύντροφος	a fellow-nursling, i.e. comrade
G3349	μετεωρίζω	to raise in mid-air, i.e. (figuratively) suspend (passively, fluctuate or be anxious)
G417	ἄνεμος	wind; (plural) by implication, (the four) quarters (of the earth)
G4688	σπεκουλάτωρ	a speculator, i.e. military scout (spy or (by extension) life-guardsman)
G1794	ἐντυλίσσω	probably akin to G1507 (ἐντυλίσσω)); to entwine, i.e. wind up in
G4622	Σιών	Sion (i.e. Tsijon), a hill of Jerusalem; figuratively, the Church (militant or triumphant)
G157	αἰτίαμα	a thing charged
G1898	ἐπεισαγωγή	a superintroduction
G2380	θύω	properly, to rush (breathe hard, blow, smoke), i.e. (by implication) to sacrifice (properly, by fire, but genitive case); by extension to immolate (slaughter for any purpose)
G3820	παλαιός	antique, i.e. not recent, worn out
G3442	μονόφθαλμος	one-eyed
G2786	Κηφᾶς	the Rock; Cephas (i.e. Kepha), a surname of Peter
G1925	ἐπιδείκνυμι	to exhibit (physically or mentally)
G1567	ἐκζητέω	to search out, i.e. (figuratively)investigate, crave, demand, (by Hebraism) worship
G4269	πρόγονος	an ancestor, (grand-)parent
G696	ἄργυρος	silver (the metal, in the articles or coin)
G1305	διατροφή	nourishment
G1408	δρόμος	a race, i.e. (figuratively) career
G5485	χάρις	graciousness (as gratifying), of manner or act (abstract or concrete; literal, figurative or spiritual; especially the divine influence upon the heart, and its reflection in the life; including gratitude)
G2916	κρίθινος	consisting of barley
G1708	ἐμπλοκή	elaborate braiding of the hair
G2046	ἐρέω	an alternate for G2036 (ἐρέω) in certain tenses; to utter, i.e. speak or say
G501	ἀντλέω	to bale up (properly, bilge water), i.e. dip water (with a bucket, pitcher, etc.)
G5124	τοῦτο	that thing
G4667	Σμύρνα	Smyrna, a place in Asia Minor
G75	ἀγωνίζομαι	to struggle, literally (to compete for a prize), figuratively (to contend with an adversary), or genitive case (to endeavor to accomplish something)
G743	ἀρχάγγελος	a chief angel
G5232	ὑπεραυξάνω	to increase above ordinary degree
G2286	θανάσιμος	fatal, i.e. poisonous
G5544	χρηστότης	usefulness, i.e. morally, excellence (in character or demeanor)
G4979	σχοινίον	of uncertain derivation); a rushlet, i.e. grass-withe or tie (generally)
G5370	φίλημα	a kiss
G206	ἄκρον	the extremity
G1908	ἐπηρεάζω	to insult, slander
G4257	προακούω	to hear already,i.e. anticipate
G4329	προσδοκία	apprehension (of evil); by implication, infliction anticipated
G3706	ὅρασις	the act of gazing, i.e. (externally) an aspect or (internally) an inspired appearance
G3961	πατέω	to trample (literally or figuratively)
G4614	Σινᾶ	Sina (i.e. Sinai), a mountain in Arabia
G4341	προσκαλέομαι	to call toward oneself, i.e. summon, invite
G5502	χερουβίμ	"cherubim" (i.e. cherubs or kerubim)
G677	ἀπρόσκοπος	actively, inoffensive, i.e. not leading into sin; passively, faultless, i.e. not led into sin
G1512	εἴ περ	if perhaps
G2584	Καπερναούμ	Capernaum (i.e. Caphanachum), a place in Palestine
G3845	παραβαίνω	to go contrary to, i.e. violate a command
G2710	καταχράομαι	to overuse, i.e. misuse
G4291	προΐστημι	to stand before, i.e. (in rank) to preside, or (by implication) to practise
G2926	κρύπτη	a hidden place, i.e. cellar ("crypt")
G68	ἀγρός	a field (as a drive for cattle); genitive case, the country; specially, a farm, i.e. hamlet
G5270	ὑποκάτω	down under, i.e. beneath
G5006	ταλαντιαῖος	talent-like in weight
G2626	κατακλύζω	to dash (wash) down, i.e. (by implication) to deluge
G5239	ὑπερεκτείνω	to extend inordinately
G3414	μνᾶ	a mna (i.e. mina), a certain weight
G4604	σίδηρος	iron
G46	ἄγναφος	properly, unfulled, i.e. (by implication) new (cloth)
G1882	ἐπανόρθωσις	a straightening up again, i.e. (figuratively) rectification (reformation)
G5029	τάχα	shortly, i.e. (figuratively) possibly
G4342	προσκαρτερέω	to be earnest towards, i.e. (to a thing) to persevere, be constantly diligent, or (in a place) to attend assiduously all the exercises, or (to a person) to adhere closely to (as a servitor)
G4094	πίναξ	a plate
G2404	Ἱεράπολις	holy city; Hierapolis, a place in Asia Minor
G2578	κάμπτω	to bend
G3787	ὀφθαλμοδουλεία	sight-labor, i.e. that needs watching (remissness)
G2108	εὐεργεσία	beneficence (genitive case or specially)
G1877	ἐπανάγω	to lead up on, i.e. (technical) to put out (to sea); (intransitively) to return
G4627	σκάφη	a "skiff" (as if dug out), or yawl (carried aboard a large vessel for landing)
G1686	ἐμβάπτω	to whelm on, i.e. wet (a part of the person, etc.) by contact with a fluid
G5446	φυσικός	"physical", i.e. (by implication) instinctive
G4717	σταυρόω	to impale on the cross; figuratively, to extinguish (subdue) passion or selfishness
G4035	περιλείπω	to leave all around, i.e. (passively) survive
G3080	λύσις	a loosening, i.e. (specially), divorce
G5269	ὑποζώννυμι	to gird under, i.e. frap (a vessel with cables across the keel, sides and deck)
G4744	στίλβω	to gleam, i.e. flash intensely
G4544	Σάμος	Samus, an island of the Mediterranean
G3133	μαραίνω	to extinguish (as fire), i.e. (figuratively and passively) to pass away
G5072	τετράμηνον	a four months' space
G5304	ὑστέρησις	a falling short, i.e. (specially), penury
G4499	Ῥόδος	Rhodus, an island of the Mediterranean
G242	ἅλλομαι	to jump; figuratively, to gush
G1295	διασώζω	to save thoroughly, i.e. (by implication or analogy) to cure, preserve, rescue, etc.
G781	ἄσοφος	unwise
G3196	μέλος	a limb or part of the body
G975	βιβλίον	a roll
G1662	Ἐλιακείμ	Eliakim, an Israelite
G1992	ἐπιστολή	a written message
G1696	ἐμμένω	to stay in the same place, i.e. (figuratively) persevere
G3639	ὄλεθρος	a prolonged form); ruin, i.e. death, punishment
G3166	μεγαλαυχέω	akin to G837 (μεγαλαυχέω) and G2744 (μεγαλαυχέω)); to talk big, i.e. be grandiloquent (arrogant, egotistic)
G194	ἄκρατος	undiluted
G5596	ψωμίον	a crumb or morsel (as if rubbed off), i.e. a mouthful
G4225	πού	as adverb of place, somewhere, i.e. nearly
G3957	πάσχα	the Passover (the meal, the day, the festival or the special sacrifices connected with it)
G5597	ψώχω	to triturate, i.e. (by analogy) to rub out (kernels from husks with the fingers or hand)
G4522	σαγήνη	a "seine" for fishing
G2038	ἐργάζομαι	to toil (as a task, occupation, etc.), (by implication) effect, be engaged in or with, etc.
G32	ἄγγελος	compare G34 (ἄγγελος)) (to bring tidings); a messenger; especially an "angel"; by implication, a pastor
G4053	περισσός	superabundant (in quantity) or superior (in quality); by implication, excessive; adverbially (with G1537 (περισσός)) violently; neuter (as noun) preeminence
G3812	παιδιόθεν	from infancy
G5451	φυτεία	trans-planting, i.e. (concretely) a shrub or vegetable
G305	ἀναβαίνω	to go up (literally or figuratively)
G5170	Τρύφαινα	luxurious; Tryphæna, a Christian woman
G4231	πραγματεύομαι	to busy oneself with, i.e. to trade
G472	ἀντέχομαι	to hold oneself opposite to, i.e. (by implication) adhere to; by extension to care for
G3506	νεύω	to "nod", i.e. (by analogy), signal
G3667	ὁμοίωμα	a form; abstractly, resemblance
G3583	ξηραίνω	to desiccate; by implication, to shrivel, to mature
G3603	ὅ ἐστι	which is
G4734	Στεφανᾶς	from G4737 (Στεφανᾶς)); Stephanas, a Christian
G3575	Νῶε	Noë, (i.e. Noäch), a patriarch
G2694	κατασύρω	to drag down, i.e. arrest judicially
G1261	διαλογισμός	discussion, i.e. (internal) consideration (by implication, purpose), or (external) debate
G590	ἀπόδημος	absent from one's own people, i.e. a foreign traveller
G640	ἀπορία	a (state of) quandary
G1703	ἐμπαίκτης	a derider, i.e. (by implication) a false teacher
G4822	συμβιβάζω	causative (by reduplication) of the base of G939 (συμβιβάζω)); to drive together, i.e. unite (in association or affection), (mentally) to infer, show, teach
G3681	ὄνειδος	notoriety, i.e. a taunt (disgrace)
G2980	λαλέω	to talk, i.e. utter words
G1131	γυμνός	nude (absolute or relative, literal or figurative)
G2589	καρδιογνώστης	a heart-knower
G1881	ἐπανίσταμαι	to stand up on, i.e. (figuratively) to attack
G5257	ὑπηρέτης	an under-oarsman, i.e. (generally) subordinate (assistant, sexton, constable)
G2272	ἡσύχιος	properly, keeping one's seat (sedentary), i.e. (by implication) still (undisturbed, undisturbing)
G3520	νῆσος	an island
G93	ἀδικία	(legal) injustice (properly, the quality, by implication, the act); morally, wrongfulness (of character, life or act)
G5573	ψευδολόγος	mendacious, i.e. promulgating erroneous Christian doctrine
G3047	λίψ	the south(- west) wind (as bringing rain, i.e. (by extension) the south quarter)
G5186	τυφλόω	to make blind, i.e. (figuratively) to obscure
G3354	μετρέω	to measure (i.e. ascertain in size by a fixed standard); by implication, to admeasure (i.e. allot by rule)
G2909	κρείττων	stronger, i.e. (figuratively) better, i.e. nobler
G2799	κλαίω	to sob, i.e. wail aloud (whereas 1145 is rather to cry silently)
G4455	πώποτε	at any time, i.e. (with negative particle) at no time
G4260	προβαίνω	to walk forward, i.e. advance (literally, or in years)
G4465	ῥαβδοῦχος	a rod- (the Latin fasces) holder, i.e. a Roman lictor (constable or executioner)
G5303	ὑστέρημα	a deficit; specially, poverty
G5403	Φοινίκη	palm-country; Phœnice (or Phœnicia), a region of Palestine
G447	ἀνίημι	to let up, i.e. (literally) slacken or (figuratively) desert, desist from
G3464	μύρον	"myrrh", i.e. (by implication) perfumed oil
G1125	γράφω	to "grave", especially to write; figuratively, to describe
G4871	συναλίζω	to accumulate, i.e. convene
G2961	κυριεύω	to rule
G2377	θυρωρός	a gate- warden
G3012	λέντιον	a "linen" cloth, i.e. apron
G4057	περισσῶς	superabundantly
G325	ἀναδίδωμι	to hand over
G3116	μακροθυμώς	with long (enduring) temper, i.e. leniently
G1796	ἐνυβρίζω	to insult
G3320	μεσότοιχον	a partition (figuratively)
G633	ἀπονίπτω	to wash off (reflexively, one's own hands symbolically)
G400	ἀναφωνέω	to exclaim
G1576	ἐκκλείω	to shut out (literally or figuratively)
G4626	σκάπτω	to dig
G3900	παράπτωμα	a side-slip (lapse or deviation), i.e. (unintentional) error or (wilful) transgression
G3545	νομίμως	legitimately (specially, agreeably to the rules of the lists)
G2155	εὔσπλαγχνος	well compassioned, i.e. sympathetic
G2964	κυρόω	to make authoritative, i.e. ratify
G1154	Δαμασκός	Damascus, a city of Syria
G936	βασιλεύω	to rule (literally or figuratively)
G5479	χαρά	cheerfulness, i.e. calm delight
G1228	διάβολος	a traducer; specially, Satan (compare H07854)
G1922	ἐπίγνωσις	recognition, i.e. (by implication) full discernment, acknowledgement
G4787	συγκινέω	to move together, i.e. (specially), to excite as a mass (to sedition)
G3811	παιδεύω	to train up a child, i.e. educate, or (by implication), discipline (by punishment)
G935	βασιλεύς	a sovereign (abstractly, relatively, or figuratively)
G4934	συντίθεμαι	to place jointly, i.e. (figuratively) to consent (bargain, stipulate), concur
G3411	μισθωτός	a wage-worker (good or bad)
G1800	Ἐνώς	Enos (i.e. Enosh), a patriarch
G3200	μεμβράνα	a (written) sheep-skin
G348	ἀνακόπτω	to beat back, i.e. check
G3717	ὀρθός	right (as rising), i.e. (perpendicularly) erect (figuratively, honest), or (horizontally) level or direct
G87	ἀδιάκριτος	properly, undistinguished, i.e. (actively) impartial
G1245	διακαθαρίζω	to cleanse perfectly, i.e. (specially) winnow
G4630	Σκευᾶς	left-handed; Scevas (i.e. Scævus), an Israelite
G3500	νέκρωσις	decease; figuratively, impotency
G705	ἀριθμέω	to enumerate or count
G2183	ἐφημερία	diurnality, i.e. (specially) the quotidian rotation or class of the Jewish priests' service at the Temple, as distributed by families
G2954	Κύπρος	Cyprus, an island in the Mediterranean
G426	ἀνετάζω	to investigate (judicially)
G4811	συκοφαντέω	to be a fig-informer (reporter of the law forbidding the exportation of figs from Greece), "sycophant", i.e. (genitive and by extension) to defraud (exact unlawfully, extort)
G3065	Λουκᾶς	Lucas, a Christian
G5132	τράπεζα	a table or stool (as being four-legged), usually for food (figuratively, a meal); also a counter for money (figuratively, a broker's office for loans at interest)
G599	ἀποθνήσκω	to die off (literally or figuratively)
G314	ἀναγινώσκω	to know again, i.e. (by extension) to read
G4793	συγκρίνω	to judge of one thing in connection with another, i.e. combine (spiritual ideas with appropriate expressions) or collate (one person with another by way of contrast or resemblance)
G377	ἀναπίπτω	to fall back, i.e. lie down, lean back
G1016	βοῦς	an ox (as grazing), i.e. an animal of that species ("beef")
G4745	στοά	a colonnade or interior piazza
G3530	Νικόδημος	victorious among his people; Nicodemus, an Israelite
G1447	Ἑβραϊστί	Hebraistically or in the Jewish (Chaldee) language
G5278	ὑπομένω	to stay under (behind), i.e. remain; figuratively, to undergo, i.e. bear (trials), have fortitude, persevere
G4138	πλήρωμα	repletion or completion, i.e. (subjectively) what fills (as contents, supplement, copiousness, multitude), or (objectively) what is filled (as container, performance, period)
G1198	δέσμιος	a captive (as bound)
G1860	ἐπαγγελία	an announcement (for information, assent or pledge; especially a divine assurance of good)
G2017	ἐπιφαύω	to illuminate (figuratively)
G825	Ἀττάλεια	Attaleia, a place in Pamphylia
G4486	ῥήσσω	G2608 (ῥήσσω) being its intensive (with the preposition in composition), and G2352 (ῥήσσω) a shattering to minute fragments; but not a reduction to the constituent particles, like G3089 (ῥήσσω)) or disrupt, lacerate; by implication, to convulse (with spasms); figuratively, to give vent to joyful emotions
G4417	πταίω	to trip, i.e. (figuratively) to err, sin, fail (of salvation)
G653	ἀποστοματίζω	to speak off-hand (properly, dictate), i.e. to catechize (in an invidious manner)
G1917	ἐπιβουλή	a plan against someone, i.e. a plot
G2090	ἑτοιμάζω	to prepare
G253	ἀλυπότερος	more without grief
G5383	φιλοπρωτεύω	to be fond of being first, i.e. ambitious of distinction
G494	Ἀντιπατρίς	Antipatris, a place in Palestine
G4393	προφέρω	to bear forward, i.e. produce
G5536	χρῆμα	something useful or needed, i.e. wealth, price
G1899	ἔπειτα	thereafter
G5067	τέταρτος	fourth
G2596	κατά	(prepositionally) down (in place or time), in varied relations (according to the case (genitive, dative or accusative) with which it is joined)
G5085	Τιβεριάς	Tiberias, the name of a town and a lake in Palestine
G4856	συμφωνέω	to be harmonious, i.e. (figuratively) to accord (be suitable, concur) or stipulate (by compact)
G5379	φιλονεικία	quarrelsomeness, i.e. a dispute
G2535	Κάϊν	Cain, (i.e. Cajin), the son of Adam
G5585	ψηφίζω	to use pebbles in enumeration, i.e. (generally) to compute
G4304	προμελετάω	to premeditate
G2398	ἴδιος	pertaining to self, i.e. one's own; by implication, private or separate
G2299	θεά	a female deity
G3593	ὁδεύω	to travel
G5569	ψευδάδελφος	a spurious brother, i.e. pretended associate
